{
  "chainId": 8453,
  "registryAddress": "0xe11044811237170c0fa8f0bfb38f5b6f07cf5dbf",
  "groupId": "0xf030f72e772f954059ca28f94974088aaf6ba37bb1f264df48843a3d0c221dc3",
  "name": "Pro",
  "slug": "pro",
  "description": "Established takers in the narrowest, highest-volume historical cohort.",
  "curator": {
    "address": "0x84e113087c97cd80ea9d78983d4b8ff61eca1929",
    "name": "Peer",
    "slug": "peer",
    "links": {
      "website": "https://peer.xyz/",
      "source": "https://github.com/zkp2p/peer-curator"
    }
  },
  "membership": {
    "description": "Wallets with at least $10,000 in historical fulfilled taker volume, subject to the published lock-score demotion and blocked-wallet rules. Members are also included in Plus and Peer because membership is cumulative.",
    "criteriaURI": "https://github.com/zkp2p/peer-curator#high-level-tiers",
    "sourceURI": "https://github.com/zkp2p/peer-curator",
    "refreshCadence": "PT12H"
  },
  "groupSet": {
    "slug": "historical-taker",
    "name": "Historical Taker",
    "membershipSemantics": "minimum-tier",
    "tier": {
      "key": "pro",
      "rank": 3
    }
  },
  "tags": [
    "peer",
    "reputation",
    "taker",
    "historical"
  ],
  "links": {
    "docs": "https://github.com/zkp2p/peer-curator#high-level-tiers",
    "source": "https://github.com/zkp2p/peer-curator"
  }
}
