{
  "chainId": 8453,
  "registryAddress": "0xe11044811237170c0fa8f0bfb38f5b6f07cf5dbf",
  "groupId": "0xe2ada1e143bc3a45398381b4b5bbb9e7ed6ccba40225168f32e9702e0c4e8260",
  "name": "Earn Pro",
  "slug": "earn-pro",
  "description": "Established participants in the narrowest, highest-volume frozen Earn cohort.",
  "curator": {
    "address": "0x84e113087c97cd80ea9d78983d4b8ff61eca1929",
    "name": "Peer",
    "slug": "peer",
    "links": {
      "website": "https://peer.xyz/",
      "source": "https://github.com/zkp2p/peer-curator"
    }
  },
  "membership": {
    "description": "Wallets with at least $50,000 in frozen Earn-qualified volume, subject to the published lock-score demotion and blocked-wallet rules. Members are also included in Earn Plus and Earn Peer because membership is cumulative.",
    "criteriaURI": "https://github.com/zkp2p/peer-curator#high-level-tiers",
    "sourceURI": "https://github.com/zkp2p/peer-curator",
    "refreshCadence": "PT12H"
  },
  "groupSet": {
    "slug": "current-earn",
    "name": "Current Earn",
    "membershipSemantics": "minimum-tier",
    "tier": {
      "key": "pro",
      "rank": 3
    }
  },
  "tags": [
    "peer",
    "reputation",
    "earn"
  ],
  "links": {
    "docs": "https://github.com/zkp2p/peer-curator#high-level-tiers",
    "source": "https://github.com/zkp2p/peer-curator"
  }
}
