{
  "chainId": 8453,
  "registryAddress": "0x39f80118f9eb619135f116171b6cb91d372c5af2",
  "groupId": "0x76d8468179105f4ec9ba8f553823f44dcde6eeb997ba5b70da09849effc0375e",
  "name": "Plus",
  "slug": "plus",
  "description": "Takers with at least $2,000 of fulfilled PayPal, Venmo, or Cash App volume.",
  "curator": {
    "address": "0x84e113087c97cd80ea9d78983d4b8ff61eca1929",
    "name": "Peer",
    "slug": "peer",
    "links": {
      "website": "https://peer.xyz/",
      "source": "https://github.com/zkp2p/peer-curator"
    }
  },
  "membership": {
    "description": "Wallets with at least $2,000 in fulfilled taker volume summed only across PayPal, Venmo, and Cash App, excluding blocked wallets. Members are also included in Peer because membership is cumulative.",
    "criteriaURI": "https://github.com/zkp2p/peer-curator#high-level-tiers",
    "sourceURI": "https://github.com/zkp2p/peer-curator",
    "refreshCadence": "PT12H"
  },
  "groupSet": {
    "slug": "historical-taker",
    "name": "Historical Taker",
    "membershipSemantics": "minimum-tier",
    "tier": {
      "key": "plus",
      "rank": 2
    }
  },
  "tags": [
    "peer",
    "reputation",
    "taker",
    "historical"
  ],
  "links": {
    "docs": "https://github.com/zkp2p/peer-curator#high-level-tiers",
    "source": "https://github.com/zkp2p/peer-curator"
  }
}
