{
  "chainId": 8453,
  "registryAddress": "0xe11044811237170c0fa8f0bfb38f5b6f07cf5dbf",
  "groupId": "0x76d8468179105f4ec9ba8f553823f44dcde6eeb997ba5b70da09849effc0375e",
  "name": "Earn Plus",
  "slug": "earn-plus",
  "description": "Established participants in the narrower, higher-volume frozen Earn cohort.",
  "curator": {
    "address": "0x84e113087c97cd80ea9d78983d4b8ff61eca1929",
    "name": "Peer",
    "slug": "peer",
    "links": {
      "website": "https://peer.xyz/",
      "source": "https://github.com/zkp2p/peer-curator"
    }
  },
  "membership": {
    "description": "Wallets with at least $10,000 in frozen Earn-qualified volume, subject to the published lock-score demotion and blocked-wallet rules. Members are also included in Earn Peer because membership is cumulative.",
    "criteriaURI": "https://github.com/zkp2p/peer-curator#high-level-tiers",
    "sourceURI": "https://github.com/zkp2p/peer-curator",
    "refreshCadence": "PT12H"
  },
  "groupSet": {
    "slug": "current-earn",
    "name": "Current Earn",
    "membershipSemantics": "minimum-tier",
    "tier": {
      "key": "plus",
      "rank": 2
    }
  },
  "tags": [
    "peer",
    "reputation",
    "earn"
  ],
  "links": {
    "docs": "https://github.com/zkp2p/peer-curator#high-level-tiers",
    "source": "https://github.com/zkp2p/peer-curator"
  }
}
