{
  "chainId": 8453,
  "registryAddress": "0x54Ff7788Cb42B46FE2F016a65Fd0f654Bb9BcF3D",
  "groupId": "0xe53d8c4a4748e18a1fe34a07037b8b5146ddf2c03372bd32164925f9a17d4ea6",
  "name": "Peer Chargebackable Volume (Staging)",
  "slug": "peer-chargeback-staging",
  "description": "Staging cohort for takers with at least $500 of fulfilled PayPal, Venmo, or Cash App volume.",
  "curator": {
    "address": "0x84e113087c97cd80ea9d78983d4b8ff61eca1929",
    "name": "Peer",
    "slug": "peer",
    "links": {
      "website": "https://peer.xyz/",
      "source": "https://github.com/zkp2p/peer-curator"
    }
  },
  "membership": {
    "description": "Wallets with at least $500 in fulfilled taker volume summed only across PayPal, Venmo, and Cash App, excluding blocked wallets. Higher tiers are included because membership is cumulative.",
    "criteriaURI": "https://github.com/zkp2p/peer-curator#high-level-tiers",
    "sourceURI": "https://github.com/zkp2p/peer-curator",
    "refreshCadence": "PT12H"
  },
  "groupSet": {
    "slug": "historical-taker-chargeback-staging",
    "name": "Historical Taker Chargeback (Staging)",
    "membershipSemantics": "minimum-tier",
    "tier": {
      "key": "peer",
      "rank": 1
    }
  },
  "tags": [
    "peer",
    "reputation",
    "taker",
    "historical",
    "chargebackable",
    "staging"
  ],
  "links": {
    "docs": "https://github.com/zkp2p/peer-curator#high-level-tiers",
    "source": "https://github.com/zkp2p/peer-curator"
  }
}
